{
  "candidates": [
    {
      "authority_exclusions": [
        "must not own AXM semantic action identifiers",
        "must not grant actor, role, mandate, or disposition authority",
        "must not become the canonical run record",
        "must not become an AXM engine dependency"
      ],
      "capabilities": [
        "station roles",
        "game master",
        "mission scripting",
        "HTTP API",
        "DMX",
        "Android clients"
      ],
      "category": "bridge-simulator",
      "community_signal": "Long-running cross-platform project with hosted games, community channels, scripting, hardware, DMX, and HTTP support.",
      "decision": "reference",
      "decision_basis": "Useful as a large corpus of station and scenario decisions, but its game rules are not a reusable authority substrate.",
      "estate_targets": [
        "axm-world",
        "axm-arc"
      ],
      "evidence": [
        {
          "claim": "Documents cross-platform stations, community play, scripting, HTTP API, hardware, and DMX.",
          "kind": "official-project",
          "locator": "https://github.com/daid/EmptyEpsilon/blob/master/README.md"
        }
      ],
      "id": "empty-epsilon",
      "integration_mode": "design-reference",
      "license": "GPL-3.0",
      "license_posture": "strong-copyleft",
      "maturity": "mature-community",
      "name": "EmptyEpsilon",
      "priority": "P1",
      "required_adapter": null,
      "reuse_surface": "Mine station information design, join and reconnect behavior, GM tools, and scripted mission patterns.",
      "risks": [
        "Strong copyleft and a monolithic C++ game architecture."
      ],
      "substitution_test": null,
      "supplier_role": "multi-station bridge-game reference",
      "upstream": {
        "project_url": "https://github.com/daid/EmptyEpsilon",
        "repository": "daid/EmptyEpsilon"
      }
    },
    {
      "authority_exclusions": [
        "must not own AXM semantic action identifiers",
        "must not grant actor, role, mandate, or disposition authority",
        "must not become the canonical run record"
      ],
      "capabilities": [
        "join and rejoin",
        "multi-bridge",
        "engineering",
        "damage control",
        "Lua missions",
        "voice chat"
      ],
      "category": "bridge-simulator",
      "community_signal": "Substantial open LAN bridge simulator demonstrated in hacker-space installations.",
      "decision": "reference",
      "decision_basis": "Provides battle-tested multi-seat and low-cost station lessons while remaining tightly coupled to its own universe and renderer.",
      "estate_targets": [
        "axm-world",
        "axm-arc"
      ],
      "evidence": [
        {
          "claim": "Documents seven stations, multi-bridge play, rejoining clients, Lua missions, voice chat, and Raspberry Pi use.",
          "kind": "official-project",
          "locator": "https://github.com/smcameron/space-nerds-in-space/blob/master/README.md"
        }
      ],
      "id": "space-nerds-in-space",
      "integration_mode": "design-reference",
      "license": "GPL-family; verify upstream",
      "license_posture": "strong-copyleft",
      "maturity": "mature-community",
      "name": "Space Nerds In Space",
      "priority": "P2",
      "required_adapter": null,
      "reuse_surface": "Use as a comparative workload for reconnect, role folding, low-power clients, and same-room LAN operation.",
      "risks": [
        "Linux-centric installation and bespoke network/game stack."
      ],
      "substitution_test": null,
      "supplier_role": "LAN multi-crew systems-game reference",
      "upstream": {
        "project_url": "https://github.com/smcameron/space-nerds-in-space",
        "repository": "smcameron/space-nerds-in-space"
      }
    },
    {
      "authority_exclusions": [
        "must not own AXM semantic action identifiers",
        "must not grant actor, role, mandate, or disposition authority",
        "must not become the canonical run record"
      ],
      "capabilities": [
        "distributed clients",
        "hardware panels",
        "lighting",
        "sound",
        "video",
        "flight director"
      ],
      "category": "bridge-simulator",
      "community_signal": "Years of use in educational spaceship-simulator installations and an active support community.",
      "decision": "reference",
      "decision_basis": "Its explicit principles independently converge on distributed data, external clients, hardware panels, and operator-centered control.",
      "estate_targets": [
        "axm-world",
        "estate-lab",
        "axm-console"
      ],
      "evidence": [
        {
          "claim": "Describes a distributed, fault-tolerant show-control system with external hardware clients.",
          "kind": "official-project",
          "locator": "https://github.com/Thorium-Sim/thorium/blob/develop/README.md"
        }
      ],
      "id": "thorium-classic",
      "integration_mode": "design-reference",
      "license": "See upstream",
      "license_posture": "unknown",
      "maturity": "mature-community",
      "name": "Thorium Classic",
      "priority": "P1",
      "required_adapter": null,
      "reuse_surface": "Use its failure and operator-load lessons as acceptance cases for station authoring and director surfaces.",
      "risks": [
        "Legacy dependency stack and application-specific data model."
      ],
      "substitution_test": null,
      "supplier_role": "distributed show-control architecture reference",
      "upstream": {
        "project_url": "https://github.com/Thorium-Sim/thorium",
        "repository": "Thorium-Sim/thorium"
      }
    },
    {
      "authority_exclusions": [
        "must not own AXM semantic action identifiers",
        "must not grant actor, role, mandate, or disposition authority",
        "must not become the canonical run record",
        "must not define Common Ship or Underdrain law"
      ],
      "capabilities": [
        "distributed stations",
        "flight director control",
        "timeline automation",
        "peripheral API",
        "DMX and media integration"
      ],
      "category": "bridge-simulator",
      "community_signal": "Next-generation continuation of a long-running simulator-controls community.",
      "decision": "reference",
      "decision_basis": "This is the closest public product-shaped analogue, but importing its domain model would give a bridge simulator authority over AXM cartridges.",
      "estate_targets": [
        "axm-world",
        "estate-lab",
        "axm-console"
      ],
      "evidence": [
        {
          "claim": "Exposes third-party peripheral request and mutation endpoints.",
          "kind": "official-project",
          "locator": "https://github.com/Thorium-Sim/thorium-nova/blob/develop/SERVER_API.md"
        }
      ],
      "id": "thorium-nova",
      "integration_mode": "design-reference",
      "license": "Apache-2.0",
      "license_posture": "permissive",
      "maturity": "active-emerging",
      "name": "Thorium Nova",
      "priority": "P0",
      "required_adapter": null,
      "reuse_surface": "Harvest station topology, flight-director ergonomics, peripheral API patterns, and show-control seams as comparative fixtures.",
      "risks": [
        "Large application architecture is coupled to its own simulator object model."
      ],
      "substitution_test": null,
      "supplier_role": "distributed simulator and show-control reference",
      "upstream": {
        "project_url": "https://github.com/Thorium-Sim/thorium-nova",
        "repository": "Thorium-Sim/thorium-nova"
      }
    },
    {
      "authority_exclusions": [
        "must not own AXM semantic action identifiers",
        "must not grant actor, role, mandate, or disposition authority",
        "must not become the canonical run record",
        "firmware may render outputs but may not adjudicate game state"
      ],
      "capabilities": [
        "ESP32 S2/S3",
        "USB HID",
        "WiFi",
        "BLE",
        "serial",
        "RS485",
        "LEDs",
        "displays",
        "steppers",
        "generated mappings"
      ],
      "category": "cockpit-hardware",
      "community_signal": "Active cockpit-builder project with generated label sets, multiple transports, debug record/replay, and documented scale tests.",
      "decision": "adapt",
      "decision_basis": "It independently implements most of the Enigma edge layer and is a high-value firmware supplier, but DCS label sets and DCS-BIOS transport must be replaced by AXM contracts.",
      "estate_targets": [
        "supplier-foundry",
        "axm-embodied",
        "estate-lab"
      ],
      "evidence": [
        {
          "claim": "Provides static-memory ESP32 panel firmware, multiple transports, generated label sets, and record/replay tools.",
          "kind": "official-project",
          "locator": "https://github.com/BojoteX/CockpitOS/blob/main/README.md"
        }
      ],
      "id": "cockpitos",
      "integration_mode": "firmware-supplier",
      "license": "MIT",
      "license_posture": "permissive",
      "maturity": "active-emerging",
      "name": "CockpitOS",
      "priority": "P0",
      "required_adapter": "cockpitos-axm-mailbox-adapter/v1",
      "reuse_surface": "Fork only the bounded firmware and generated mapping substrate behind an AXM protocol adapter; retain upstream as replaceable supplier.",
      "risks": [
        "Young project, DCS coupling, and Windows-native authoring tools."
      ],
      "substitution_test": "Flash the same board with CockpitOS-derived and AXM-native supplier builds and require identical normalized input and desired-output traces.",
      "supplier_role": "ESP32 panel firmware and configuration toolchain",
      "upstream": {
        "project_url": "https://github.com/BojoteX/CockpitOS",
        "repository": "BojoteX/CockpitOS"